{"$defs":{"entry":{"additionalProperties":false,"properties":{"entry_id":{"$ref":"#/$defs/id"},"kind":{"enum":["decision","constraint","discovery","preference"]},"source_event_ids":{"items":{"$ref":"#/$defs/id"},"maxItems":64,"minItems":1,"type":"array","uniqueItems":true},"subject_id":{"$ref":"#/$defs/id"},"value_hash":{"$ref":"#/$defs/sha"}},"required":["entry_id","kind","subject_id","value_hash","source_event_ids"],"type":"object"},"event_ref":{"additionalProperties":false,"properties":{"content_hash":{"$ref":"#/$defs/sha"},"format":{"const":"world-forge.agent_event"},"format_version":{"const":1},"id":{"$ref":"#/$defs/id"}},"required":["format","format_version","id","content_hash"],"type":"object"},"id":{"maxLength":64,"minLength":2,"pattern":"^[a-z][a-z0-9_]{1,63}$","type":"string"},"receipt_ref":{"additionalProperties":false,"properties":{"content_hash":{"$ref":"#/$defs/sha"},"format":{"const":"world-forge.agent_execution_receipt"},"format_version":{"const":1},"id":{"$ref":"#/$defs/id"}},"required":["format","format_version","id","content_hash"],"type":"object"},"review":{"additionalProperties":false,"properties":{"decision":{"const":"approved"},"policy_hash":{"$ref":"#/$defs/sha"},"policy_id":{"$ref":"#/$defs/id"},"policy_version":{"$ref":"#/$defs/revision"},"receipt_content_hash":{"$ref":"#/$defs/sha"},"review_id":{"$ref":"#/$defs/id"},"reviewer_id":{"$ref":"#/$defs/id"}},"required":["review_id","reviewer_id","policy_id","policy_version","policy_hash","receipt_content_hash","decision"],"type":"object"},"revision":{"maximum":9007199254740991,"minimum":1,"type":"integer"},"sha":{"pattern":"^[0-9a-f]{64}$","type":"string"}},"$id":"https://world-forge.local/schemas/agent-memory-projection.schema.json","$schema":"https://json-schema.org/draft/2020-12/schema","additionalProperties":false,"properties":{"content_hash":{"$ref":"#/$defs/sha"},"entries":{"items":{"$ref":"#/$defs/entry"},"maxItems":64,"minItems":1,"type":"array","uniqueItems":true},"execution_id":{"$ref":"#/$defs/id"},"format":{"const":"world-forge.agent_memory_projection"},"format_version":{"const":1},"projection_id":{"$ref":"#/$defs/id"},"receipt":{"$ref":"#/$defs/receipt_ref"},"review":{"$ref":"#/$defs/review"},"source_events":{"items":{"$ref":"#/$defs/event_ref"},"maxItems":64,"minItems":1,"type":"array","uniqueItems":true}},"required":["format","format_version","projection_id","execution_id","receipt","source_events","review","entries","content_hash"],"title":"Immutable Agent Memory Projection v1","type":"object","x-world-forge-agent-harness-coherent":true}