{"content_hash":"cf15d0232d8869fa7340b2959afa8ee5140e49a214d906fa66a55e70082ee983","entries":[{"entry_id":"entry_01","kind":"discovery","source_event_ids":["event_00","event_01"],"subject_id":"subject_01","value_hash":"eeeeeeeeeeeeeeeeeeeeeeeeeeeeeeeeeeeeeeeeeeeeeeeeeeeeeeeeeeeeeeee"}],"execution_id":"execution_01","format":"world-forge.agent_memory_projection","format_version":1,"projection_id":"projection_01","receipt":{"content_hash":"cd4234b80b0417b805c412ecb6aa47999c5b3c2c57a99b9616dcb03b29fbc1a7","format":"world-forge.agent_execution_receipt","format_version":1,"id":"receipt_01"},"review":{"decision":"approved","policy_hash":"dddddddddddddddddddddddddddddddddddddddddddddddddddddddddddddddd","policy_id":"memory_policy","policy_version":1,"receipt_content_hash":"cd4234b80b0417b805c412ecb6aa47999c5b3c2c57a99b9616dcb03b29fbc1a7","review_id":"review_01","reviewer_id":"reviewer_01"},"source_events":[{"content_hash":"ff88c9000d4f888742204bff0125de3ebfbc4f2bd27b510a8aebd8b05f47f37c","format":"world-forge.agent_event","format_version":1,"id":"event_00"},{"content_hash":"4d6bf25556a8603e57216bac2ed0463b648cfd3522249b117a294fbe4251041e","format":"world-forge.agent_event","format_version":1,"id":"event_01"}]}